{
  "$schema": "http://json-schema.org/draft-07/schema#",
  "title": "Open Call Configuration Schema",
  "description": "Schema for validating open-call.json files used in Photo Open Call Analyzer. See ADR-007: Configuration Validation Schema.",
  "type": "object",
  "required": ["title", "theme", "jury", "pastWinners"],
  "additionalProperties": true,
  "properties": {
    "title": {
      "type": "string",
      "minLength": 3,
      "maxLength": 200,
      "description": "Competition title (e.g., 'Sony World Photography Awards 2025')"
    },
    "theme": {
      "type": "string",
      "minLength": 5,
      "maxLength": 1000,
      "description": "Photography theme or subject description for this competition"
    },
    "jury": {
      "type": "array",
      "minItems": 1,
      "maxItems": 50,
      "items": {
        "type": "string",
        "minLength": 2,
        "maxLength": 100,
        "description": "Name or title of jury member"
      },
      "description": "List of jury members (their names, roles, or affiliations)"
    },
    "pastWinners": {
      "type": "string",
      "minLength": 10,
      "maxLength": 2000,
      "description": "Description of past winning photos and their characteristics (style, themes, technical quality)"
    },
    "model": {
      "type": "string",
      "minLength": 2,
      "maxLength": 100,
      "description": "Optional Ollama vision model override for this project (e.g., 'llava:13b', 'moondream'). See FR-3.9 / ADR-019."
    },
    "context": {
      "type": "string",
      "maxLength": 2000,
      "description": "Optional additional context for evaluation (e.g., competition mission, special focus areas)"
    },
    "customCriteria": {
      "type": "array",
      "maxItems": 10,
      "items": {
        "type": "object",
        "required": ["name"],
        "additionalProperties": false,
        "properties": {
          "name": {
            "type": "string",
            "minLength": 2,
            "maxLength": 50,
            "description": "Criterion name (e.g., 'Originality', 'Technical Excellence')"
          },
          "description": {
            "type": "string",
            "minLength": 5,
            "maxLength": 500,
            "description": "Criterion description"
          },
          "weight": {
            "type": "number",
            "minimum": 1,
            "maximum": 100,
            "description": "Relative weight/importance (will be normalized to 100%)"
          }
        }
      },
      "description": "Optional: Custom evaluation criteria (if not provided, AI generates from theme/jury)"
    },
    "submissionRules": {
      "type": "object",
      "description": "Submission-level compliance rules (FR-4.3). Validated by submission-validator.js.",
      "additionalProperties": false,
      "properties": {
        "maxPhotos": {
          "type": "integer",
          "minimum": 1,
          "maximum": 100,
          "description": "Maximum number of photos allowed in submission"
        },
        "minPhotos": {
          "type": "integer",
          "minimum": 1,
          "maximum": 100,
          "description": "Minimum number of photos required"
        },
        "deadline": {
          "type": "string",
          "pattern": "^\\d{4}-\\d{2}-\\d{2}$",
          "description": "Submission deadline in ISO format (YYYY-MM-DD)"
        },
        "requiredFormat": {
          "type": "string",
          "enum": ["jpg", "jpeg", "png", "webp"],
          "description": "Required image format for submission"
        },
        "maxSizeMB": {
          "type": "number",
          "minimum": 0.1,
          "maximum": 100,
          "description": "Maximum file size per photo in MB"
        }
      }
    },
    "photoGroups": {
      "type": "array",
      "description": "Optional photo sub-groups/series for constrained set generation (FR-4.8). When defined, suggest-sets generates combinations only within each group.",
      "minItems": 1,
      "maxItems": 20,
      "items": {
        "type": "object",
        "required": ["name", "pattern"],
        "additionalProperties": false,
        "properties": {
          "name": {
            "type": "string",
            "minLength": 1,
            "maxLength": 100,
            "description": "Human-readable group name (e.g., 'Rotterdam', 'October Series')"
          },
          "pattern": {
            "type": "string",
            "minLength": 1,
            "maxLength": 200,
            "description": "Glob pattern to match filenames in photos/ directory (e.g., 'rotterdam*.jpg', '2025-10-*.jpg')"
          }
        }
      }
    },
    "setMode": {
      "type": "object",
      "description": "Configuration for set/group analysis (e.g., Polaroid 4-photo sets). See ADR-015.",
      "additionalProperties": false,
      "properties": {
        "enabled": {
          "type": "boolean",
          "default": false,
          "description": "Enable set-level analysis mode"
        },
        "setSize": {
          "type": "integer",
          "minimum": 2,
          "maximum": 10,
          "default": 4,
          "description": "Number of photos per set (default: 4 for Polaroid)"
        },
        "setCriteria": {
          "type": "array",
          "maxItems": 8,
          "items": {
            "type": "object",
            "required": ["name"],
            "additionalProperties": false,
            "properties": {
              "name": {
                "type": "string",
                "minLength": 2,
                "maxLength": 50,
                "description": "Set criterion name (e.g., 'Visual Coherence')"
              },
              "description": {
                "type": "string",
                "minLength": 5,
                "maxLength": 500,
                "description": "Set criterion description"
              },
              "weight": {
                "type": "number",
                "minimum": 1,
                "maximum": 100,
                "description": "Relative weight/importance (will be normalized to 100%)"
              }
            }
          },
          "description": "Criteria for evaluating photo sets as a group (if not provided, defaults are used)"
        },
        "maxSetsToEvaluate": {
          "type": "integer",
          "minimum": 1,
          "maximum": 50,
          "default": 10,
          "description": "Maximum number of candidate sets to fully evaluate with vision model"
        },
        "individualWeight": {
          "type": "number",
          "minimum": 0,
          "maximum": 100,
          "default": 40,
          "description": "Weight of individual photo scores in final set score (0-100)"
        },
        "setWeight": {
          "type": "number",
          "minimum": 0,
          "maximum": 100,
          "default": 60,
          "description": "Weight of set-level scores in final set score (0-100)"
        }
      }
    }
  }
}
