{
  "title": "Nature Photography Open Call 2026",
  "theme": "Wildlife in Their Natural Habitat",
  "jury": ["Jane Smith (National Geographic)", "Marco Rossi (Wildlife Photographer)", "Lisa Chen (Museum Curator)"],
  "pastWinners": "Previous winners focused on intimate wildlife moments, showing behavior and emotion rather than just documentation. Strong emphasis on environmental context and natural lighting.",
  "context": "This is a prestigious international open call for wildlife and nature photography. Jurors are looking for images that tell a story about wildlife and their ecosystems."
}
